"Category","Term","First_Paper_Title","First_Paper_Link","First_Paper_Year","First_Paper_Abstract","First_Paper_Authors","First_Paper_Citations"
"Technique","Autoencoders","CEUR Workshop Proceedings","","2018","The proceedings contain 15 papers. The topics discussed include: Dr Cookie and Mr Token web session implementations and how to live with them; performance of Botnet detection by neural networks in software-defined networks; extending domain name monitoring. identifying potentially malicious domains using hash signatures of DOM elements; data leakage in Java applets with exception mechanism; PBFT vs proof-of-authority: applying the CAP theorem to permissioned blockchain; malware detection through low-level features and stacked denoising autoencoders; preventing ransomware attacks through file system filter drivers; understanding the Twitter user networks of viruses and ransomware attacks; static analysis for GDPR compliance; a distributed cybersecurity framework for heterogeneous environments; cross-cloud management of sensitive data via blockchain: a payslip calculation use case; visualizing Bitcoin flows of ransomware: WannaCry one week later; MAD-IOS: dynamic app vulnerability analysis in non-jail-broken devices; enforcing security in IoT and home networks; and firewall management with firewall synthesizer.","","0"
"Technique","Generative Adversarial Networks","Defending IT systems against intelligent malware","10.1109/DESSERT.2018.8409169","2018","The increasing amount of malware variants seen in the wild is causing problems for Antivirus Software vendors, unable to keep up by creating signatures for each. The methods used to develop a signature, static and dynamic analysis, have various limitations. Machine learning has been used by Antivirus vendors to detect malware based on the information gathered from the analysis process. However, adversarial examples can cause machine learning algorithms to miss-classify new data. In this paper we describe a method for malware analysis by converting malware binaries to images and then preparing those images for training within a Generative Adversarial Network. These unsupervised deep neural networks are not susceptible to adversarial examples. The conversion to images from malware binaries should be faster than using dynamic analysis and it would still be possible to link malware families together. Using the Generative Adversarial Network, malware detection could be much more effective and reliable. © 2018 IEEE.","Kargaard J.; Drange T.; Kor A.-L.; Twafik H.; Butterfield E.","17"
"Technique","HTTP Analysis","Advancing Malware Classification With an Evolving Clustering Method","10.4018/IJAMC.2018070101","2018","This article describes how honeypots and intrusion detection systems serve as major mechanisms for security administrators to collect a variety of sample viruses and malware for further analysis, classification, and system protection. However, increased variety and complexity of malware makes the analysis and classification challenging, especially when efficiency and timely response are two contradictory yet equally significant criteria in malware classification. Besides, similarity-based classifications exhibit insufficiency because the mutation and fuzzification of malware exacerbate classification difficulties. In order to improve malware classification speed and attend to mutation, this research proposes the ameliorated progressive classification that integrates static analysis and improved k-means algorithm. This proposed classification aims at assisting network administrators to have a malware classification preprocess and make efficient malware classifications upon the capture of new malware, thus enhancing the defense against malware. Copyright © 2018, IGI Global.","Chen C.-M.; Wang S.-H.","0"
"Technique","Transfer Learning","DeepOrigin: End-To-End Deep Learning for Detection of New Malware Families","10.1109/IJCNN.2018.8489667","2018","In this paper, we present a novel method of differentiating known from previously unseen malware families. We utilize transfer learning by learning compact file representations that are used for a new classification task between previously seen malware families and novel ones. The learned file representations are composed of static and dynamic features of malware files and are invariant to small modifications that do not change the malware functionality. Using an extensive dataset that consists of thousands of variants of malicious files, we were able to achieve 97.7% accuracy when classifying between seen and unseen malware families. Our method provides an important focalizing tool for cybersecurity researchers and greatly improves the overall ability to adapt to the fast-moving pace of the current threat landscape. © 2018 IEEE.","Cordonsky I.; Rosenberg I.; Sicard G.; David E.O.","19"
"Technique","Entropy Analysis","Evaluating disassembly-code based similarity between IoT malware samples","10.1109/AsiaJCIS.2018.00023","2018","Malware samples infecting IoT (Internet of Things) devices such as web cameras and home routers have spread over the Internet, which are called IoT malware. When an IoT malware sample is captured, analyzing it can be a time-consuming task. Classification is a good solution leading to efficient malware analysis. That is, if a captured sample can be automatically classified into a malware family of already-analyzed samples, their analysis results will be a useful hint for analysis. In this research, we focus on (static) disassembly to extract features from samples used for calculating their similarities for classification. This is because disassembling malware binaries can be faster than, for example, dynamic analysis under which each sample should be run for a few minutes. However, if samples are packed (encrypted and/or compressed), disassembly does not work well. As a first step towards classification, the goal of this paper is to answer two questions: Are most IoT malware samples not packed? and Can disassembly-code based similarity work well for classification? To this end, with experiments using 8,713 in-the-wild IoT malware samples, we conducted entropy analysis and confirmed that most samples were not packed. We then generated similarity matrices based on disassembly code. After that, we visualized the samples with t-SNE (t-Distributed Stochastic Neighbor Embedding) based on the similarity matrices, and we also confirmed that similar samples were closely mapped on a two-dimensional plane and that distinct samples were comparatively, separately mapped. This means that disassembly can work well against IoT malware for classification. © 2018 IEEE.","Isawa R.; Ban T.; Tie Y.; Yoshioka K.; Inoue D.","9"
"Technique","AutoML for Malware","HAAMD: Hybrid Analysis for Android Malware Detection","10.1109/ICCCI.2018.8441295","2018","With the growth in popularity of smartphone and the number of its users, the dispersion of mobile malware on Android platform has also increased. Currently Android is the hot target of attackers because it has occupied most of the market share. The growing popularity and demand of the smartphone, the large portion of market share covered by Android and the open nature of the android make an android more eye-catching platform for malwares. Scientifically, it is very crucial for an examiner to observe the malicious app's behavior to understand the danger to privacy and security. It may not be possible for an approach to detect the malware at alone, sufficiently, as many advanced techniques are there. So, we can use multiple approaches for effective detection of malware. In this paper, comparison among various kind of analysis techniques (static, dynamic) for Android malware is emphasized. This paper also accommodates different sub-techniques of these analysis techniques, with their functionality used for detection of malware and the comparative facts between these two type of analysis is discussed. In this research, the new technique has been evolved by combining static and dynamic analysis which is named as hybrid analysis and then the effectiveness of this new technique(hybrid analysis) is compared with pre-existed techniques. © 2018 IEEE.","Choudhary M.; Kishore B.","31"
"Technique","Gray-Level Co-occurrence Matrix","Malware Visualization for Fine-Grained Classification","10.1109/ACCESS.2018.2805301","2018","Due to the rapid rise of automated tools, the number of malware variants has increased dramatically, which poses a tremendous threat to the security of the Internet. Recently, some methods for quick analysis of malware have been proposed, but these methods usually require a large computational overhead and cannot classify samples accurately for large-scale and complex malware data set. Therefore, in this paper, we propose a new visualization method for characterizing malware globally and locally to achieve fast and effective fine-grained classification. We take a new approach to visualize malware as RGB-colored images and extract global features from the images. Gray-level co-occurrence matrix and color moments are selected to describe the global texture features and color features, respectively, which produces low-dimensional feature data to reduce the complexity of training model. Moreover, a series of special byte sequences are extracted from code sections and data sections of malware and are processed into feature vectors by Simhash as the local features. Finally, we merge the global features and local features to perform malware classification using random forest, K-nearest neighbor, and support vector machine. Experimental results show that our approach obtains the highest accuracy of 97.47% and the highest F-measure of 96.85% of 7087 samples from 15 families. Color features and the local features effectively assist in the classification based on texture features and enhance the F-measure by 3.4% and 1%, respectively. Overall, the combination of global features and local features can realize fine-grained malware classification with low computational cost. © 2013 IEEE.","Fu J.; Xue J.; Wang Y.; Liu Z.; Shan C.","118"
"Technique","System Call Monitoring","HM3alD: Polymorphic malware detection using program behavior-aware hidden Markov model","10.3390/app8071044","2018","Malware have been tremendously growing in recent years. Most malware use obfuscation techniques for evasion and hiding purposes, but they preserve the functionality and malicious behavior of original code. Although most research work has been mainly focused on program static analysis, some recent contributions have used program behavior analysis to detect malware at run-time. Extracting the behavior of polymorphic malware is one of the major issues that affects the detection result. In this paper, we propose HM3alD, a novel program behavior-aware hidden Markov model for polymorphic malware detection. The main idea is to use an effective clustering scheme to partition the program behavior of malware instances and then apply a novel hidden Markov model (called program behavior-aware HMM) on each cluster to train the corresponding behavior. Low-level program behavior, OS-level system call sequence, is mapped to high-level action sequence and used as transition triggers across states in program behavior-aware HMM topology. Experimental results show that HM3alD outperforms all current dynamic and static malware detection methods, especially in term of FAR, while using a large dataset of 6349 malware. © 2018 by the authors.","Tajoddin A.; Jalili S.","15"
"Technique","Gabor Filtering","Adaptive Mitigation of Multi-Virus Propagation: A Passivity-Based Approach","10.1109/TCNS.2016.2633791","2018","Malware propagation poses a growing threat to networked systems, such as computer networks and cyberphysical systems. Current approaches to defend against malware propagation are based on patching or filtering susceptible nodes at a fixed rate. When the propagation dynamics are unknown or uncertain, however, the static rate that is chosen may be either insufficient to remove all viruses or too high, incurring additional performance cost. In this paper, we formulate adaptive strategies for mitigating multiple malware epidemics when the propagation rate is unknown, using patching and filtering-based defense mechanisms. In order to identify conditions for ensuring that all viruses are asymptotically removed, we show that the malware propagation, patching, and filtering processes can be modeled as coupled passive dynamical systems. We prove that the patching rate required to remove all viruses is bounded above by the passivity index of the coupled system, and formulate the problem of selecting the minimum-cost mitigation strategy. Our results are evaluated through a numerical study. © 2014 IEEE.","Lee P.; Clark A.; Alomair B.; Bushnell L.; Poovendran R.","10"
"Technique","Graph Neural Networks","Call Graph Based Android Malware Detection with CNN","10.1007/978-981-15-0310-8_5","2019","With the increasing shipment of Android malware, malicious APK detection becomes more important. Based on static analysis, we propose a new perspective to detect malicious behaviors. In particular, we extract the patterns of suspicious APIs which are invoked together. We call these patterns local features. We propose a convolutional neural network(CNN) model based on APK’s call graph to extract local features. With the comparison of detection experiments, we demonstrate that the local features indeed help to detect malicious APKs and our model is effective in extracting local features. © 2019, Springer Nature Singapore Pte Ltd.","Liu Y.; Li G.; Jin Z.","1"
"Technique","Adversarial Training","AIMED: Evolving malware with genetic programming to evade detection","10.1109/TrustCom/BigDataSE.2019.00040","2019","Genetic Programming (GP) has previously proved to achieve valuable results on the fields of image processing and arcade learning. Similarly, it can be used as an adversarial learning approach to evolve malware samples until static learning classifiers are no longer able to detect it. While the implementation is relatively simple compared with other Machine Learning approaches, results proved that GP can be a competitive solution to find adversarial malware examples comparing with similar methods. Thus, AIMED - Automatic Intelligent Malware Modifications to Evade Detection - was designed and imple-mented using genetic algorithms to evade malware classifiers. Our experiments suggest that the time to achieve adversarial malware samples can be reduced up to 50% compared to classic random approaches. Moreover, we implemented AIMED to generate adversarial examples using individual malware scanners as target and tested the evasive files against further classifiers from both research and industry. The generated examples achieved up to 82% of cross-evasion rates among the classifiers. © 2019 IEEE.","Castro R.L.; Schmitt C.; Dreo G.","41"
"Technique","Opcode Frequency Analysis","An OpCODE sequences analysis method for unknown malware detection","10.1145/3318236.3318255","2019","One of the main challenges in security today is defending against unknown malware attacks which have the potential to harm a computer or network. Hence, detecting malware has become one of the most important challenges for the security of computer systems. The known malware detection methods based on the appearance of opcode sequences has to construct a matrix from programs of different architectures to extract high-level features. In order to resolve high dimensional inputs vector and differences assembly instruction, this paper proposes a novel method for detecting static characteristics of 32-bit and 64-bit malicious Portable Executable (PE) Windows files by opcode sequences analysis. By compute the frequency of occurrence of each opcode sequence and distinguishing different types of 32-bit and 64-bit PE files, the proposed method shows promising results with less complexity in comparison with previous studies, which is beneficial to train machine learning model such as k-nearest neighbor (KNN) and back-propagation neural network (BP). Our method is evaluated on more than 20,000 samples, and experimental results show that our system can effectively detect and classify unknown malware. © 2019 Association for Computing Machinery.","Sun Z.; Rao Z.; Chen J.; Xu R.; He D.; Yang H.; Liu J.","27"
"Technique","Model Compression","26th International Conference on Neural Information Processing, ICONIP 2019","","2019","The proceedings contain 111 papers. The special focus in this conference is on Neural Information Processing. The topics include: A Robustness and Low Bit-Rate Image Compression Network for Underwater Acoustic Communication; gated Contiguous Memory U-Net for Single Image Dehazing; combined Correlation Filters with Siamese Region Proposal Network for Visual Tracking; RAUNet: Residual Attention U-Net for Semantic Segmentation of Cataract Surgical Instruments; a Novel Image-Based Malware Classification Model Using Deep Learning; visual Saliency Detection via Convolutional Gated Recurrent Units; RBPNET: An Asymptotic Residual Back-Projection Network for Super Resolution of Very Low Resolution Face Image; accurate Single Image Super-Resolution Using Deep Aggregation Network; Reinforcing LiDAR-Based 3D Object Detection with RGB and 3D Information; cross-View Image Retrieval - Ground to Aerial Image Retrieval Through Deep Learning; multi-person 3D Pose Estimation from Monocular Image Sequences; Direct Image to Point Cloud Descriptors Matching for 6-DOF Camera Localization in Dense 3D Point Clouds; improving Object Detection with Consistent Negative Sample Mining; A Model Selection Criterion for LASSO Estimate with Scaling; geometric Mean Metric Learning for Label Distribution Learning; Explicit Center Selection and Training for Fault Tolerant RBF Networks; Learning with Incomplete Labels for Multi-label Image Annotation Using CNN and Restricted Boltzmann Machines; learning-Based Confidence Estimation for Multi-modal Classifier Fusion; Siamese Network for Classification with Optimization of AUC; attention-Based Audio-Visual Fusion for Video Summarization; RLDR-Pruning: Restricted Linear Dimensionality Reduction Approach for Model Compression; super-Resolution Network for General Static Degradation Model; adaptive Neuro-Surrogate-Based Optimisation Method for Wave Energy Converters Placement Optimisation; sparse Least Squares Low Rank Kernel Machines.","","0"
"Technique","Neural Network Classification","Detection of Malware using Artificial Neural Networks","10.1109/IMITEC45504.2019.9015848","2019","Artificial Neural Network techniques have found numerous applications in our world today, one of such is in malware detection. Classification is one of the most popular approach used in neural network. In this paper we present an artificial neural network classification approach to detecting a file hash as malware. A static approach is presented and used in this analysis. Performance analysis of obtained model is measured against other popular techniques. Evaluation results shows comparable accuracy and computation time. © 2019 IEEE.","Olowoyo O.; Owolawi P.A.","1"
"Technique","DNS Analysis","Android Applications Analysis Using PerUpSecure","10.1007/978-3-030-11878-5_1","2019","Since its introduction in 2008, Google’s Android has been a blazing success, far outstripping the market share of all other mobile operating systems. Android ships more than one billion new devices each year, and more than 1.5 million new devices are activated every day. This growth was not without pain, however. Recent measures estimate that 96–97% of today’s mobile malware targets the Android operating system, and 73% of them are specifically designed to satisfy profit motives. In addition, as the system becomes more popular and scrutinized, the number of vulnerabilities identified has exploded. The security of Android is a key issue for Google, the mobile OS is - by far - the most popular in the world. The Android security mechanism is founded on an instrument that gives users all the information about the permissions requested by the application before installing it. The main benefit of this Android permission system is to provide users an overview of the application by showing them the requested permissions list, which can help raise awareness of its risks on their private data. However, we still do not have enough information to allow us to say that standard users are able to clearly understand the permissions requested and their implications for their security. In this article, we present a tool called “PerUpSecure” multiphases that combines dynamic and static analysis and contrary to what we know about the installation process of Android applications that puts in front of the user only two options, either he accepts all requested permissions or he cancels the installation, our proposed tool allows the user to install any application with only the necessary permissions. At the end of this article, we present the analysis results of a set of normal applications and malicious programs collected from different markets. © 2019, Springer Nature Switzerland AG.","Er-Rajy L.; El Kiram M.A.; El Ghazouani M.","0"
"Technique","Multi-Modal Learning","Towards Multimodal Learning for Android Malware Detection","10.1109/ICCNC.2019.8685502","2019","As the worldwide adoption of smartphones nears complete saturation, the complexity and volume of mobile malware continue to progress, subverting what has become the largest set of targets with the most valuable rewards. At the same time, deep learning has become a powerful tool for data analysis and prediction, demonstrating significant efficacy in the detection of new and unforeseen malicious software through supervised learning. Despite these advances, the proper application of deep learning to malware detection could be further improved through additional data and model construction. In this work, we consider the detection of Android malware using static analysis techniques on multiple extractable data classes. Particularly, both Permission and Hardware Feature data are applied in various multimodal input scenarios and deep network shapes. Through experimental analysis, we demonstrate that the combination of both sets of data could improve overall performance, achieving as high as 94.5% classification accuracy. In addition, using only a limited grid search, we observe that the largest multimodal network requires the lowest time to train while achieving equivalent or greater accuracy compared with our other models. © 2019 IEEE.","Mcgiff J.; Hatcher W.G.; Nguyen J.; Yu W.; Blasch E.; Lu C.","32"
"Technique","Online Learning","Deep networks in online malware detection","","2019","Deep learning is usually applied to static datasets. If used for classification based on data streams, it is not easy to take into account a non-stationarity. This paper presents work in progress on a new method for online deep classification learning in data streams with slow or moderate drift, highly relevant for the application domain of malware detection. The method uses a combination of multilayer perceptron and variational autoencoder to achieve constant memory consumption by encoding past data to a generative model. This can make online learning of neural networks more accessible for independent adaptive systems with limited memory. First results for real-world malware stream data are presented. Copyright © 2019 for this paper by its authors.","Tumpach J.; Krčál M.; Holeňa M.","1"
"Technique","Metric Learning","26th International Conference on Neural Information Processing, ICONIP 2019","","2019","The proceedings contain 111 papers. The special focus in this conference is on Neural Information Processing. The topics include: A Robustness and Low Bit-Rate Image Compression Network for Underwater Acoustic Communication; gated Contiguous Memory U-Net for Single Image Dehazing; combined Correlation Filters with Siamese Region Proposal Network for Visual Tracking; RAUNet: Residual Attention U-Net for Semantic Segmentation of Cataract Surgical Instruments; a Novel Image-Based Malware Classification Model Using Deep Learning; visual Saliency Detection via Convolutional Gated Recurrent Units; RBPNET: An Asymptotic Residual Back-Projection Network for Super Resolution of Very Low Resolution Face Image; accurate Single Image Super-Resolution Using Deep Aggregation Network; Reinforcing LiDAR-Based 3D Object Detection with RGB and 3D Information; cross-View Image Retrieval - Ground to Aerial Image Retrieval Through Deep Learning; multi-person 3D Pose Estimation from Monocular Image Sequences; Direct Image to Point Cloud Descriptors Matching for 6-DOF Camera Localization in Dense 3D Point Clouds; improving Object Detection with Consistent Negative Sample Mining; A Model Selection Criterion for LASSO Estimate with Scaling; geometric Mean Metric Learning for Label Distribution Learning; Explicit Center Selection and Training for Fault Tolerant RBF Networks; Learning with Incomplete Labels for Multi-label Image Annotation Using CNN and Restricted Boltzmann Machines; learning-Based Confidence Estimation for Multi-modal Classifier Fusion; Siamese Network for Classification with Optimization of AUC; attention-Based Audio-Visual Fusion for Video Summarization; RLDR-Pruning: Restricted Linear Dimensionality Reduction Approach for Model Compression; super-Resolution Network for General Static Degradation Model; adaptive Neuro-Surrogate-Based Optimisation Method for Wave Energy Converters Placement Optimisation; sparse Least Squares Low Rank Kernel Machines.","","0"
