"Category","Term","First_Paper_Title","First_Paper_Link","First_Paper_Year","First_Paper_Abstract","First_Paper_Authors","First_Paper_Citations"
"Domain","Infrastructure as a Service","A dynamic malware detection in cloud platform","10.37622/IJDE/15.2.2020.243-258","2021","Cloud computing not only provides high availability on elastic resources, scalable, and cost-efficient. The platform is also widely used in information technology (IT) to support technology infrastructure and services. However, due to the complex environment and scalability of services, one of the highest security issues is malware attacks, where some of the antivirus scanner unable to detect metamorphic malware or encrypted malware where these kinds of malware able to bypass some traditional protection solution. This is why a high recognition rate and good precision detection are important to eliminate a high false-positive rate. Machine Learning (ML) classifiers are a critical role in artificial intelligent-system. However, machine learning will require to learn from the high amplitude of input data; classify then only able to generate a reliable model with a high detection rate. The objective of this work is to study and performs detection based on dynamic malware analysis and classification is through the WEKA classifier and Random Forest Jupyter Notebook. There are three classifiers chosen in this work, which are Random Forest, J-48, and Naive Bayes with 10-folds validation from the WEKA tool and another additional classifier from Random Forest - Jupyter Notebook to substantiate the accuracy. © Research India Publications","Fui N.L.Y.; Asmawi A.; Hussin M.","7"
"Domain","DevSecOps","International Conference on Evolving Technologies for Computing, Communication and Smart World, ETCCS 2020","","2021","The proceedings contain 40 papers. The special focus in this conference is on Evolving Technologies for Computing, Communication and Smart World. The topics include: Event-Triggered Share Price Prediction; a Review: Efficient Transportation—Future Aspects of IoV; Compact High Gain 28 GHz Concentric Circular Director Low-Cost Antenna for 5G Millimeter-Wave Communication; preface; toward Response-Type Identification for the Real Time; questionnaire-Based Prediction of Hypertension Using Machine Learning; nature-Inspired Computing Behaviour of Cellular Automata; a Survey on Transport Layer Protocols for Reliable and Secure Wireless Sensor Networks; A Lightweight Exchangeable Encryption Scheme for IoT Devices Based on Vigenere Cipher and MLS Keystream; improving Steepest Descent Method by Learning Rate Annealing and Momentum in Neural Network; fingerprint and Face-Based Secure Biometric Authentication System Using Optimized Robust Features; DevOps, DevSecOps, AIOPS- Paradigms to IT Operations; Optimized Route Discovery and Node Registration for FANET; 4.1 GHz Low-Phase Noise Differential XCP LC-VCO with High Q and LC Noise Filtering; secured Surveillance Storage Model Using Blockchain; automatic Leaf Species Recognition Using Deep Neural Network; information Retrieval in Financial Documents; VNF Security in Telco Environment; Rank-Level Fusion of Random Indexing, Word Embedding, and TF-IDF-Based Rankings for Clinical Document Retrieval; a Novel Feature Engineering Approach for Twitter-Based Text Sentiment Analysis; Survey on DDoS and EDoS Attack in Cloud Environment; preprocessing Steps for Opinion Mining on Tweets; machine Learning-Based Lightweight Android Malware Detection System with Static Features; area and Power Efficient 2 Bit Multiplier by Using Enhanced Half Adder; the Modified Algorithm of Quantum Key Distribution System Synchronization; breast Cancer Classification Using Transfer Learning.","","0"
"Domain","Database Security","Implementing Enterprise Cybersecurity With Open-Source Software and Standard Architecture","","2021","Many small and medium scale businesses cannot afford to procure expensive cybersecurity tools. In many cases, even after procurement, lack of a workforce with knowledge of the standard architecture of enterprise security, tools are often used ineffectively. The Editors have developed multiple projects which can help in developing cybersecurity solution architectures and the use of the right tools from the open-source software domain. This book has 8 chapters describing these projects in detail with recipes on how to use open-source tooling to obtain standard cyber defense and the ability to do self-penetration testing and vulnerability assessment. This book also demonstrates work related to malware analysis using machine learning and implementation of honeypots, network Intrusion Detection Systems in a security operation center environment. It is essential reading for cybersecurity professionals and advanced students. © 2021 River Publishers.","Handa A.; Negi R.; Shukla S.K.","2"
"Domain","Supply Chain Attack Domain","Towards Measuring Supply Chain Attacks on Package Managers for Interpreted Languages","10.14722/ndss.2021.23055","2021","Package managers have become a vital part of the modern software development process. They allow developers to reuse third-party code, share their own code, minimize their codebase, and simplify the build process. However, recent reports showed that package managers have been abused by attackers to distribute malware, posing significant security risks to developers and end-users. For example, eslint-scope, a package with millions of weekly downloads in Npm, was compromised to steal credentials from developers. To understand the security gaps and the misplaced trust that make recent supply chain attacks possible, we propose a comparative framework to qualitatively assess the functional and security features of package managers for interpreted languages. Based on qualitative assessment, we apply well-known program analysis techniques such as metadata, static, and dynamic analysis to study registry abuse. Our initial efforts found 339 new malicious packages that we reported to the registries for removal. The package manager maintainers confirmed 278 (82%) from the 339 reported packages where three of them had more than 100, 000 downloads. For these packages we were issued official CVE numbers to help expedite the removal of these packages from infected victims. We outline the challenges of tailoring program analysis tools to interpreted languages and release our pipeline as a reference point for the community to build on and help in securing the software supply chain. © 2021 28th Annual Network and Distributed System Security Symposium, NDSS 2021. All Rights Reserved.","Duan R.; Alrawi O.; Kasturi R.P.; Elder R.; Saltaformaggio B.; Lee W.","61"
"Domain","POS Terminal Malware","Android Malware Detection via Behavior-Based Features","10.1007/978-981-15-5887-0_13","2021","With the rapid development of Android smartphones and the widespread use of mobile Internet as well as the open-source Android system, the mobile terminal malware has been widely spread and became popular. In order to detect malware and prevent the interests of mobile phone users from being infringed, this paper performs a malware detection via both the static and dynamic features generated by a user’s operator behavior, software behavior, and malicious behavior. © 2021, The Editor(s) (if applicable) and The Author(s), under exclusive license to Springer Nature Singapore Pte Ltd.","Li Y.; Liu Y.","0"
"Domain","Container Security","Implementing a Method for Docker Image Security; [Docker Görüntü Güvenli?ine Yönelik Bir Yöntem Uygulamas]","10.1109/ISCTURKEY53027.2021.9654383","2021","Containers that can be easily created, transported and scaled with the use of container-based virtualization technologies work better than classical virtualization technologies and provide efficient resource usage. The Docker platform is one of the most widely used solutions among container-based virtualization technologies. The OS-level virtualization of the Docker platform and the container's use of the host operating system kernel may cause security problems. In this study, a method including static and dynamic analysis has been proposed to ensure Docker image and container security. In the static analysis phase of the method, the packages of the images are scanned for vulnerabilities and malware. In the dynamic analysis phase, Docker containers are run for a certain period of time, after the open port scanning, network traffic is analyzed with the Snort3. Seven Docker images are analyzed and the results are shared.  © 2021 IEEE.","Sengul O.; Ozkilicaslan H.; Arda E.; Yavanoglu U.; Dogru I.A.; Selcuk A.A.","7"
"Domain","Threat Hunting Methodologies","Efficient Threat Hunting Methodology for Analyzing Malicious Binaries in Windows Platform","10.1007/978-3-030-76352-7_54","2021","The rising cyber threat puts organizations and ordinary users at risk of data breaches. In many cases, Early detection can hinder the occurrence of these incidents or even prevent a full compromise of all internal systems. The existing security controls such as firewalls and intrusion prevention systems are constantly blocking numerous intrusions attempts that happen on a daily basis. However, new situations may arise where these security controls are not sufficient to provide full protection. There is a necessity to establish a threat hunting methodology that can assist investigators and members of the incident response team to analyse malicious binaries quickly and efficiently. The methodology proposed in this research is able to distinguish malicious binaries from benign binaries using a quick and efficient way. The proposed methodology consists of static and dynamic hunting techniques. Using these hunting techniques, the proposed methodology is not only capable of identifying a range of signature-based anomalies but also to pinpoint behavioural anomalies that arise in the operating system when malicious binaries are triggered. Static hunting can describe any extracted artifacts as malicious depending on a set of pre-defined patterns of malicious software. Dynamic hunting can assist investigators in finding behavioural anomalies. This work focuses on applying the proposed threat hunting methodology on samples of malicious binaries, which can be found in common malware repositories and presenting the results. © 2021, Springer Nature Switzerland AG.","Elmisery A.M.; Sertovic M.; Qasem M.","0"
"Domain","Cryptominer Detection","MineDetector: JavaScript Browser-side Cryptomining Detection using Static Methods","10.1109/CSE53436.2021.00022","2021","Because of the rise of the Monroe coin, many JavaScript files with embedded malicious code are used to mine cryptocurrency using the computing power of the browser client. This kind of script does not have any obvious behaviors when it is running, so it is difficult for common users to witness them easily. This feature could lead the browser side cryptocurrency mining abused without the user's permission. Traditional browser security strategies focus on information disclosure and malicious code execution, but not suitable for such scenes. Thus, we present a novel detection method named MineDetector using a machine learning algorithm and static features for automatically detecting browser-side cryptojacking scripts on the websites. MineDetector extracts five static feature groups available from the abstract syntax tree and text of codes and combines them using the machine learning method to build a powerful cryptojacking classifier. In the real experiment, MineDetector achieves the accuracy of 99.41% and the recall of 93.55% and has better performance in time comparing with present dynamic methods. We also made our work user-friendly by developing a browser extension that is click-to-run on the Chrome browser.  © 2021 IEEE.","Wang P.; Sun Y.; Huang C.; Du Y.; Liang G.; Long G.","2"
"Domain","Resource Allocation","17th International Conference on Hybrid Artificial Intelligence Systems, HAIS 2022","","2022","The proceedings contain 43 papers. The special focus in this conference is on Hybrid Artificial Intelligence Systems. The topics include: A New Game Theoretic Based Random Forest for Binary Classification; concept Drift Detection to Improve Time Series Forecasting of Wind Energy Generation; a Decision Support Tool for the Static Allocation of Emergency Vehicles to Stations; adapting K-Means Algorithm for Pair-Wise Constrained Clustering of Imbalanced Data Streams; small Wind Turbine Power Forecasting Using Long Short-Term Memory Networks for Energy Management Systems; CORE-BCD-mAI: A Composite Framework for Representing, Querying, and Analyzing Big Clinical Data by Means of Multidimensional AI Tools; generalized Fisher Kernel with Bregman Divergence; A HAIS Approach to Predict the Energy Produced by a Solar Panel; companion Losses for Ordinal Regression; smartwatch Sleep-Tracking Services Precision Evaluation Using Supervised Domain Adaptation; convex Multi-Task Learning with Neural Networks; Smash: A Compression Benchmark with AI Datasets from Remote GPU Virtualization Systems; Time Series Forecasting Using Artificial Neural Networks: A Model for the IBEX 35 Index; a Fine-Grained Study of Interpretability of Convolutional Neural Networks for Text Classification; olive Phenology Forecasting Using Information Fusion-Based Imbalanced Preprocessing and Automated Deep Learning; architecture for Fault Detection in Sandwich Panel Production Using Visual Analytics; deep Reinforcement Learning-Based Resource Allocation for mm-Wave Dense 5G Networks; evolutionary Triplet Network of Learning Disentangled Malware Space for Malware Classification; a Two-Level Hybrid Based Genetic Algorithm to Solve the Clustered Shortest-Path Tree Problem Using the Prüfer Code; new Hybrid Methodology Based on Particle Swarm Optimization with Genetic Algorithms to Improve the Search of Parsimonious Models in High-Dimensional Databases; tracking and Classification of Features in the Bio-Inspired Layered Networks; Evolving Dynamic Route Generators for Open-Ended ARPs; SHAP Algorithm for Healthcare Data Classification; assessment of Creditworthiness Models Privacy-Preserving Training with Synthetic Data.","","0"
"Domain","Information Sharing","MULBER: Effective Android Malware Clustering Using Evolutionary Feature Selection and Mahalanobis Distance Metric","10.3390/sym14102221","2022","Symmetric and asymmetric patterns are fascinating phenomena that show a level of co-existence in mobile application behavior analyses. For example, static phenomena, such as information sharing through collaboration with known apps, is a good example of a symmetric model of communication, and app collusion, where apps collaborate dynamically with unknown malware apps, is an example of a serious threat with an asymmetric pattern. The symmetric nature of app collaboration can become vulnerable when a vulnerability called PendingIntent is exchanged during Inter-Component Communication (ICC). The PendingIntent (PI) vulnerability enables a flexible software model, where the PendingIntent creator app can temporarily share its own permissions and identity with the PendingIntent receiving app. The PendingIntent vulnerability does not require approval from the device user or Android OS to share the permissions and identity with other apps. This is called a PI leak, which can lead to malware attacks such as privilege escalation and component hijacking attacks. This vulnerability in the symmetric behavior of an application without validating an app’s privileges dynamically leads to the asymmetric phenomena that can damage the robustness of an entire system. In this paper, we propose MULBER, a lightweight machine learning method for the detection of Android malware communications that enables a cybersecurity system to analyze multiple patterns and learn from them to help prevent similar attacks and respond to changing behavior. MULBER can help cybersecurity teams to be more proactive in preventing dynamic PI-based communication threats and responding to active attacks in real time. MULBER performs a static binary analysis on the APK file and gathers approximately 10,755 features, reducing it to 42 key features by grouping the permissions under the above-mentioned four categories. Finally, MULBER learns from these multivariate features using evolutionary feature selection and the Mahalanobis distance metric and classifies them as either benign or malware apps. In an evaluation of 22,638 malware samples from recent Android APK malware databases such as Drebin and CICMalDroid-2020, MULBER outperformed others by clustering applications based on the Mahalanobis distance metric and detected 95.69% of malware with few false alarms and the explanations provided for each detection revealed the relevant properties of the detected malware. © 2022 by the authors.","Duraisamy Soundrapandian P.; Subbiah G.","1"
"Domain","Cyber Warfare","HELO DarkSide: Breaking Free from Katas and Embracing the Adversarial Mindset in Cybersecurity Education","10.1145/3478431.3499404","2022","The pedagogy of cybersecurity education presents an exciting challenge. Although cyber-warfare has existed for nearly four decades, we fail to adequately model the chaos of offensive cyber attacks in the classroom. Instead, coursework focuses on studying choreographed cyber-attack patterns. In this paper, we present an undergraduate cybersecurity course design that balances theoretical learning with an emphasis on exploring offensive tactics, techniques, and procedures. Labs consist of writing payloads and channels to evade detection, cobbling together operating system internals to achieve attack functionality, and developing survivable post-exploitation tools. In the exams, students develop malware capable of avoiding static and dynamic analysis and identify the strategic and tactical flaws that lead to the discovery of highly successful attack campaigns. We believe that sharing this experience will prove valuable for instructors who wish to explore offensive cyber tactics in the classroom.  © 2022 ACM.","Oconnor T.J.","10"
"Domain","Endpoint Security","PROUD-MAL: static analysis-based progressive framework for deep unsupervised malware classification of windows portable executable","10.1007/s40747-021-00560-1","2022","Enterprises are striving to remain protected against malware-based cyber-attacks on their infrastructure, facilities, networks and systems. Static analysis is an effective approach to detect the malware, i.e., malicious Portable Executable (PE). It performs an in-depth analysis of PE files without executing, which is highly useful to minimize the risk of malicious PE contaminating the system. Yet, instant detection using static analysis has become very difficult due to the exponential rise in volume and variety of malware. The compelling need of early stage detection of malware-based attacks significantly motivates research inclination towards automated malware detection. The recent machine learning aided malware detection approaches using static analysis are mostly supervised. Supervised malware detection using static analysis requires manual labelling and human feedback; therefore, it is less effective in rapidly evolutionary and dynamic threat space. To this end, we propose a progressive deep unsupervised framework with feature attention block for static analysis-based malware detection (PROUD-MAL). The framework is based on cascading blocks of unsupervised clustering and features attention-based deep neural network. The proposed deep neural network embedded with feature attention block is trained on the pseudo labels. To evaluate the proposed unsupervised framework, we collected a real-time malware dataset by deploying low and high interaction honeypots on an enterprise organizational network. Moreover, endpoint security solution is also deployed on an enterprise organizational network to collect malware samples. After post processing and cleaning, the novel dataset consists of 15,457 PE samples comprising 8775 malicious and 6681 benign ones. The proposed PROUD-MAL framework achieved an accuracy of more than 98.09% with better quantitative performance in standard evaluation parameters on collected dataset and outperformed other conventional machine learning algorithms. The implementation and dataset are available at https://bit.ly/35Sne3a. © 2021, The Author(s).","Rizvi S.K.J.; Aslam W.; Shahzad M.; Saleem S.; Fraz M.M.","32"
"Domain","Peer Review","RETRACTED ARTICLE: Detection of malware on the internet of things and its applications depends on long short-term memory network(Journal of Ambient Intelligence and Humanized Computing, (2021), 13, (1), (1-12), 10.1007/s12652-020-02823-0)","10.1007/s12652-020-02823-0","2022","The Editor-in-Chief and the publisher have retracted this article. The article was submitted to be part of a guest-edited issue. An investigation by the publisher found a number of articles, including this one, with a number of concerns, including but not limited to compromised editorial handling and peer review process, inappropriate or irrelevant references or not being in scope of the journal or guest-edited issue. Based on the investigation’s findings the Editor-in- Chief therefore no longer has confidence in the results and conclusions of this article.Author Varun Gupta disagrees with this retraction. The other authors have not responded to correspondence regardingthis retraction. The online version of this article contains the full text of the retracted article as Supplementary Information. © The Author(s), under exclusive licence to Springer-Verlag GmbH, DE part of Springer Nature 2021.","Priyadarsini K.; Mishra N.; Prasad M.; Gupta V.; Khasim S.","0"
"Domain","Ransomware Encryption","A New Scheme for Ransomware Classification and Clustering Using Static Features","10.3390/electronics11203307","2022","Ransomware is a strain of malware that disables access to the user’s resources after infiltrating a victim’s system. Ransomware is one of the most dangerous malware organizations face by blocking data access or publishing private data over the internet. The major challenge of any entity is how to decrypt the files encrypted by ransomware. Ransomware’s binary analysis can provide a means to characterize the relationships between different features used by ransomware families to track the ransomware encryption mechanism routine. In this paper, we compare the different ransomware detection approaches and techniques. We investigate the criteria, parameters, and tools used in the ransomware detection ecosystem. We present the main recommendations and best practices for ransomware mitigation. In addition, we propose an efficient ransomware indexing system that provides search functionalities, similarity checking, sample classification, and clustering. The new system scheme mainly targets native ransomware binaries, and the indexing engine depends on hybrid data from the static analyzer system. Our scheme tracks and classifies ransomware based on static features to find the similarity between different ransomware samples. This is done by calculating the absolute Jaccard index. Results have shown that Import Address Table (IAT) feature can be used to classify different ransomware more accurately than the Strings feature. © 2022 by the authors.","Yamany B.; Elsayed M.S.; Jurcut A.D.; Abdelbaki N.; Azer M.A.","19"
"Domain","Return on Investment","Malware Attacks: Dimensions, Impact, and Defenses","10.1007/978-3-030-90708-2_9","2022","Malware is a top threat to the current digital world. It will be more devastating in coming years due to the expansion of information technology in various fields of life, engagement of different type of users, and increased technical sophistication in malware. The changing motivations, multi-resource investment in malware development and Return on Investment (RoI) are the main reasons for the exponential growth in malware. Businesses and users are losing millions of dollars due to various malware attacks. Although there are different Anti-malware solutions and other security software, malware attacks are successful due to inherent limitations of these security products and common security vulnerabilities such as“zero-day”, “buffer-overflow”, etc. This book chapter provides a detailed study about malware, its propagation and attack mechanisms and discusses various anti-malware techniques (machine learning, bio-inspired algorithms etc.). It also presents possible research directions for developing tools and techniques for better protection against malware. © 2022, The Author(s), under exclusive license to Springer Nature Switzerland AG.","Kumar A.; Choi B.J.; Kuppusamy K.S.; Aghila G.","3"
