"Category","Term","First_Paper_Title","First_Paper_Link","First_Paper_Year","First_Paper_Abstract","First_Paper_Authors","First_Paper_Citations"
"Technique","Heap Analysis","Lessons learned from an investigation into the analysis avoidance techniques of malicious software","","2010","This paper outlines a number of key lessons learned from an investigation into the techniques malicious executable software can employ to hinder digital forensic examination. Malware signature detection has been recognised by researchers to be far less than ideal. Thus, the forensic analyst may be required to manually analyse suspicious files. However, in order to hinder the forensic analyst, hide its true intent and to avoid detection, modern malware can be wrapped with packers or protectors, and layered with a plethora of anti-analysis techniques. This necessitates the forensic analyst to develop static and dynamic analysis skills tailored to navigate a hostile environment. To this end, the analyst must understand the anti-analysis techniques that can be employed and how to mitigate them, the limitations of existing tools and how to extend them, and how to employ an appropriate analysis methodology to uncover the intent of the malware.","Brand M.; Valli C.; Woodward A.","10"
"Technique","Virus Analysis","Malware self protection mechanism issues in conducting malware behaviour analysis in a virtual environment as compared to a real environment","10.1109/ITSIM.2010.5561600","2010","Malware writers are constantly trying to defeat and hinder malware analysis with malware self protection mechanism. There are two main methods of malware analysis which are reverse engineering and behaviour analysis. Reverse engineering consists of static and dynamic code analysis. Behaviour analysis studies the malware's interaction in and out of the infected host. Behaviour analysis will always be a faster method compared to reverse engineering due to its more visual approach. This study will analyse issues related to malware self protection mechanism in conducting malware behaviour analysis in a virtual environment as compared to a real environment and suggestion(s), on how to overcome the problem. © 2010 IEEE.","Alsagoff S.N.","2"
"Technique","Q-Learning","Automatic behaviour-based analysis and classification system for malware detection","","2010","Malware is any kind of program explicitly designed to harm, such as viruses, trojan horses or worms. Since the amount of malware is growing exponentially, it already poses a serious security threat. Therefore, every incoming code must be analysed in order to classify it as malware or benign software. These tests commonly combine static and dynamic analysis techniques in order to extract the major amount of information from distrustful files. Moreover, the increment of the number of attacks hinders manually testing the thousands of suspicious archives that every day reach antivirus laboratories. Against this background, we address here an automatised system for malware behaviour analysis based on emulation and simulation techniques. Hence, creating a secure and reliable sandbox environment allows us to test the suspicious code retrieved without risk. In this way, we can also generate evidences and classify the samples with several machine-learning algorithms. We have developed the proposed solution, testing it with real malware. Finally, we have evaluated it in terms of reliability and time performance, two of the main aspects for such a system to work.","Devesa J.; Santos I.; Cantero X.; Penya Y.K.; Bringas P.G.","41"
"Technique","Behavioral Analysis","Malware self protection mechanism issues in conducting malware behaviour analysis in a virtual environment as compared to a real environment","10.1109/ITSIM.2010.5561600","2010","Malware writers are constantly trying to defeat and hinder malware analysis with malware self protection mechanism. There are two main methods of malware analysis which are reverse engineering and behaviour analysis. Reverse engineering consists of static and dynamic code analysis. Behaviour analysis studies the malware's interaction in and out of the infected host. Behaviour analysis will always be a faster method compared to reverse engineering due to its more visual approach. This study will analyse issues related to malware self protection mechanism in conducting malware behaviour analysis in a virtual environment as compared to a real environment and suggestion(s), on how to overcome the problem. © 2010 IEEE.","Alsagoff S.N.","2"
"Technique","Heuristic Analysis","From the design of a generic metamorphic engine to a black-box classification of antivirus detection techniques","10.1007/s11416-009-0136-2","2010","In this paper, we propose an original black-box approach concerning antivirus products evaluation. Contrary to classical tests focusing on detection rates concerning a specific malware sample, we use a generic metamorphic engine to observe the detection products behaviors. We believe that this point of view presents a double interest: First, it offers an original way of evaluating current antivirus products focusing on the observed detection technique. More precisely, the use of metamorphic malware guarantees the difficulty of static signature based detection techniques to focus only on heuristic and behavioral detection approaches. Second, by pointing out current detection capabilities, we practically evaluate the danger that complex metamorphic malware could represent. To achieve this goal, we start with the description of a generic metamorphic engine acting in two steps: obfuscation and modeling. Then, we apply this engine to a real mass-mailing worm and propose the resulting metamorphic malware samples to current antivirus products. The observed results lead to a classification of detection techniques in two main categories: the first one, relying on static detection techniques, presents low detection rates obtained by heuristic analysis. The second one, composed of behavioral detection programs, mainly focuses on elementary suspicious actions. In all cases, no product was able to detect a global malware behavior. Consequently, we consider that metamorphic malware detection still represents a real challenge for antivirus products. Through this study, we hope to help defenders understand and defend against the threat represented by this class of malware. © 2009 Springer-Verlag France.","Borello J.-M.; Filiol E.; Mé L.","7"
"Technique","Virtual Machine Detection","Measuring virtual machine detection in malware using DSD tracer","10.1007/s11416-008-0096-y","2010","Most methods for detecting that a process is running inside a virtual environment such as VMWare or Microsoft Virtual PC are well known and the paper briefly discusses the most common methods measured during the research. The measurements are conducted over a representative set of malicious files, with special regards to packer code. The results are broken down with respect to malware category, families and various commercial and non-commercial packers and presented in a graphical and tabular format. The extent of virtual machine detection problem is estimated based on the results of the research. The main subject of the paper is measurement of actual usage of Virtual machine detection methods in current malware. The research uses DSD Tracer, a dynamic-static tracing system based on an instrumented Bochs virtual machine. The system employs tracing to produce traces of execution that can be scripted or used as a basis for disassembly/emulation in IDA Pro when combined with a customised version of IDAEmul (emulator). The paper gives an overview of design and usage of DSD Tracer. © 2008 Springer-Verlag France.","Lau B.; Svajcer V.","32"
"Technique","Hierarchical Clustering","AntiBot: Clustering common semantic patterns for bot detection","10.1109/COMPSAC.2010.33","2010","Among malicious software (malware), autonomous malicious programs, called bots, are a serious problem in the Internet. The bot writers have developed a variety of techniques to evade simple signature-based detection. Concise representations of malware behavior, or semantic patterns, are much harder to evade or obfuscate. However, generating a semantic pattern for every program instance is time-consuming, and comparing with a large number of patterns creates a challenge for timely identification of bots. This paper proposes an automated approach to generate semantic patterns for bot detection. Unlike previous approaches, it is intended to find one pattern that accurately represents the important behavior of an entire class of bots, rather than of individual instances. Doing so has advantages for fast malware identification, and for distinguishing new classes of attacks from previously-seen attacks. The work uses static analysis to characterize bot behaviors , and proposes to use hierarchical clustering of the resulting semantic patterns from a set of bot programs. The goal is to identify critical, common semantic behavior that represents the functions of an entire class of the malware. This method has been prototyped and evaluated on real-world malicious bot software. Depending on parameter choices, our approach can achieve more than 95% detection rates and less than 5% false positive rates on a large set of bot programs and non-bot executables. © 2010 IEEE.","Park Y.; Zhang Q.; Reeves D.; Mulukutla V.","18"
"Technique","Interval Analysis","1st International Conference on Runtime Verification, RV 2010","","2010","The proceedings contain 39 papers. The special focus in this conference is on Runtime Verification. The topics include: Statistical model checking: An overview; Runtime verification with the RV system; a meta-aspect protocol for developing dynamic analyses; behavior abstraction in malware analysis; clara: A framework for partially evaluating finite-state runtime monitors ahead of time; Checking the correspondence between UML models and implementation; compensation-aware runtime monitoring; recovery Tasks: An Automated Approach to Failure Recovery; formally efficient program instrumentation; Code Contracts for.NET: Runtime verification and so much more; interval analysis for concurrent trace programs using transaction sequence graphs; causality analysis in contract violation; reducing configurations to monitor in a software product line; runtime instrumentation for precise flow-sensitive type analysis; trace recording for embedded systems: Lessons learned from five industrial projects; Verification of an AFDX infrastructure using simulations and probabilities; copilot: A Hard Real-Time Runtime Monitor; stealthWorks: Emulating memory errors; efficient data race detection for async-finish parallelism; run-time verification of optimistic concurrency; visual debugging for stream processing applications; who guards the guardians? — Toward V&V of health management software: (Short paper); Aspect-Oriented instrumentation with GCC; runtime Verification for Software Transactional Memories; optimized temporal monitors for systemC; runtime verification of stochastic, faulty systems; low-overhead bug fingerprinting for fast debugging; ESAT: A tool for animating logic-based specifications of evolvable component systems; a tool which mines partial execution traces to improve static analysis; larvaStat: Monitoring of statistical properties; WS-PSC monitor: A tool chain for monitoring temporal and timing properties in composite service based on property sequence chart.","","1"
"Technique","Pruning Techniques","FORECAST - Skimming off the malware cream","10.1145/2076732.2076735","2011","To handle the large number of malware samples appearing in the wild each day, security analysts and vendors employ automated tools to detect, classify and analyze malicious code. Because malware is typically resistant to static analysis, automated dynamic analysis is widely used for this purpose. Executing malicious software in a controlled environment while observing its behavior can provide rich information on a malware's capabilities. However, running each malware sample even for a few minutes is expensive. For this reason, malware analysis efforts need to select a subset of samples for analysis. To date, this selection has been performed either randomly or using techniques focused on avoiding re-analysis of polymorphic malware variants [41, 23]. In this paper, we present a novel approach to sample selection that attempts to maximize the total value of the information obtained from analysis, according to an application-dependent scoring function. To this end, we leverage previous work on behavioral malware clustering [14] and introduce a machine-learning-based system that uses all statically-available information to predict into which behavioral class a sample will fall, before the sample is actually executed. We discuss scoring functions tailored at two practical applications of large-scale dynamic analysis: the compilation of network blacklists of command and control servers and the generation of remediation procedures for malware infections. We implement these techniques in a tool called FORECAST. Large-scale evaluation on over 600,000 malware samples shows that our prototype can increase the amount of potential command and control servers detected by up to 137% over a random selection strategy and 54% over a selection strategy based on sample diversity. Copyright 2011 ACM.","Neugschwandtner M.; Comparetti P.M.; Jacob G.; Kruegel C.","25"
"Technique","Similarity Analysis","Malware detection using assembly and API call sequences","10.1007/s11416-010-0141-5","2011","One of the major problems concerning information assurance is malicious code. To evade detection, malware has also been encrypted or obfuscated to produce variants that continue to plague properly defended and patched networks with zero day exploits. With malware and malware authors using obfuscation techniques to generate automated polymorphic and metamorphic versions, anti-virus software must always keep up with their samples and create a signature that can recognize the new variants. Creating a signature for each variant in a timely fashion is a problem that anti-virus companies face all the time. In this paper we present detection algorithms that can help the anti-virus community to ensure a variant of a known malware can still be detected without the need of creating a signature; a similarity analysis (based on specific quantitative measures) is performed to produce a matrix of similarity scores that can be utilized to determine the likelihood that a piece of code under inspection contains a particular malware. Two general malware detection methods presented in this paper are: Static Analyzer for Vicious Executables (SAVE) and Malware Examiner using Disassembled Code (MEDiC). MEDiC uses assembly calls for analysis and SAVE uses API calls (Static API call sequence and Static API call set) for analysis. We show where Assembly can be superior to API calls in that it allows a more detailed comparison of executables. API calls, on the other hand, can be superior to Assembly for its speed and its smaller signature. Our two proposed techniques are implemented in SAVE) and MEDiC. We present experimental results that indicate that both of our proposed techniques can provide a better detection performance against obfuscated malware. We also found a few false positives, such as those programs that use network functions (e. g. PuTTY) and encrypted programs (no API calls or assembly functions are found in the source code) when the thresholds are set 50% similarity measure. However, these false positives can be minimized, for example by changing the threshold value to 70% that determines whether a program falls in the malicious category or not. © 2010 Springer-Verlag France.","Shankarapani M.K.; Ramamoorthy S.; Movva R.S.; Mukkamala S.","90"
"Technique","Email Analysis","Obfuscated malware detection based on boosting multilevel features","10.3724/SP.J.1001.2011.03727","2011","To cope with the problem of the low accuracy in detecting obfuscated malware, an algorithm to detect obfuscated malware based on boosting multi-level features is presented. After a disassembly analysis and static analysis for the obfuscated malware, the algorithm extracts features from three dimensions: opcode distribution, a function call graph, and a system call graph, which combines the statistic and semantic features to reflect the behavior characteristic of the malware, and then gives out the decision result based on weighted voting for a different feature analysis. It has been proven by experiment that the algorithms have a much higher accuracy on the testing dataset. © ISCAS.","Kong D.-G.; Tan X.-B.; Xi H.-S.; Gong T.; Shuai J.-M.","5"
"Technique","Mutex Analysis","Deobfuscation of virtualization-obfuscated software: A semantics-based approach","10.1145/2046707.2046739","2011","When new malware are discovered, it is important for researchers to analyze and understand them as quickly as possible. This task has been made more difficult in recent years as researchers have seen an increasing use of virtualization-obfuscated malware code. These programs are difficult to comprehend and reverse engineer, since they are resistant to both static and dynamic analysis techniques. Current approaches to dealing with such code first reverse-engineer the byte code interpreter, then use this to work out the logic of the byte code program. This outside-in approach produces good results when the structure of the interpreter is known, but cannot be applied to all cases. This paper proposes a different approach to the problem that focuses on identifying instructions that affect the observable behavior of the obfuscated code. This inside-out approach requires fewer assumptions, and aims to complement existing techniques by broadening the domain of obfuscated programs eligible for automated analysis. Results from a prototype tool on real-world malicious code are encouraging. © 2011 ACM.","Coogan K.; Lu G.; Debray S.","110"
"Technique","Information Gain","Efficient, sensitivity resistant binary instrumentation","10.1145/2001420.2001432","2011","Binary instrumentation allows users to inject new code into programs without requiring source code, symbols, or debugging information. Instrumenting a binary requires structural modifications such as moving code, adding new code, and overwriting existing code; these modifications may unintentionally change the program's semantics. Binary instrumenters attempt to preserve the intended semantics of the program by further transforming the code to compensate for these structural modifications. Current instrumenters may fail to correctly preserve program semantics or impose significant unnecessary compensation cost because they lack a formal model of the impact of their structural modifications on program semantics. These weaknesses are particularly acute when instrumenting highly optimized or malicious code, making current instrumenters less useful as tools in the security or high-performance domains. We present a formal specification of how the structural modifications used by instrumentation affect a binary's visible behavior, and have adapted the Dyninst binary instrumenter to use this specification, thereby guaranteeing correct instrumentation while greatly reducing compensation costs. When compared against the fastest widely used instrumenters our technique imposed 46% less overhead; furthermore, we can successfully instrument highly defensive binaries that are specifically looking for code patching and instrumentation. © 2011 ACM.","Bernat A.R.; Roundy K.; Miller B.P.","13"
"Technique","Macro Analysis","DeRop: Removing return-oriented programming from malware","10.1145/2076732.2076784","2011","Over the last few years, malware analysis has been one of the hottest areas in security research. Many techniques and tools have been developed to assist in automatic analysis of malware. This ranges from basic tools like disassemblers and decompilers, to static and dynamic tools that analyze malware behaviors, to automatic malware clustering and classification techniques, to virtualization technologies to assist malware analysis, to signature- and anomaly-based malware detection, and many others. However, most of these techniques and tools would not work on new attacking techniques, e.g., attacks that use return-oriented programming (ROP). In this paper, we look into the possibility of enabling existing defense technologies designed for normal malware to cope with malware using return-oriented programming. We discuss difficulties in removing ROP from malware, and design and implement an automatic converter, called deRop, that converts an ROP exploit into shellcode that is semantically equivalent with the original ROP exploit but does not use ROP, which could then be analyzed by existing malware defense technologies. We apply deRop on four real ROP malwares and demonstrate success in using deRop for the automatic conversion. We further discuss applicability and limitations of deRop. Copyright 2011 ACM.","Lu K.; Zou D.; Wen W.; Gao D.","15"
"Technique","Blending Methods","An empirical evaluation of an unpacking method implemented with dynamic binary instrumentation","10.1587/transinf.E94.D.1778","2011","Many malicious programs we encounter these days are armed with their own custom encoding methods (i.e., they are packed) to deter static binary analysis. Thus, the initial step to deal with unknown (possibly malicious) binary samples obtained from malware collecting systems ordinarily involves the unpacking step. In this paper, we focus on empirical experimental evaluations on a generic unpacking method built on a dynamic binary instrumentation (DBI) framework to figure out the applicability of the DBI-based approach. First, we present yet another method of generic binary unpacking extending a conventional unpacking heuristic. Our architecture includes managing shadow states to measure code exposure according to a simple byte state model. Among available platforms, we built an unpacking implementation on PIN DBI framework. Second, we describe evaluation experiments, conducted on wild malware collections, to discuss workability as well as limitations of our tool. Without the prior knowledge of 6029 samples in the collections, we have identified at around 64% of those were analyzable with our DBI-based generic unpacking tool which is configured to operate in fully automatic batch processing. Purging corrupted and unworkable samples in native systems, it was 72%. Copyright © 2011 The Institute of Electronics, Information and Communication Engineers.","Kim H.C.; Orii T.; Yoshioka K.; Inoue D.; Song J.; Eto M.; Shikata J.; Matsumoto T.; Nakao K.","5"
"Technique","Graph Analysis","Detecting kernel-level rootkits using data structure invariants","10.1109/TDSC.2010.38","2011","Rootkits affect system security by modifying kernel data structures to achieve a variety of malicious goals. While early rootkits modified control data structures, such as the system call table and values of function pointers, recent work has demonstrated rootkits that maliciously modify noncontrol data. Most prior techniques for rootkit detection have focused solely on detecting control data modifications and, therefore, fail to detect such rootkits. This paper presents a novel technique to detect rootkits that modify both control and noncontrol data. The main idea is to externally observe the execution of the kernel during an inference phase and hypothesize invariants on kernel data structures. A rootkit detection phase uses these invariants as specifications of data structure integrity. During this phase, violation of invariants indicates an infection. We have implemented Gibraltar, a prototype tool that infers kernel data structure invariants and uses them to detect rootkits. Experiments show that Gibraltar can effectively detect previously known rootkits, including those that modify noncontrol data structures. © 2011 IEEE.","Baliga A.; Ganapathy V.; Iftode L.","72"
"Technique","Rootkit Detection","Detecting kernel-level rootkits using data structure invariants","10.1109/TDSC.2010.38","2011","Rootkits affect system security by modifying kernel data structures to achieve a variety of malicious goals. While early rootkits modified control data structures, such as the system call table and values of function pointers, recent work has demonstrated rootkits that maliciously modify noncontrol data. Most prior techniques for rootkit detection have focused solely on detecting control data modifications and, therefore, fail to detect such rootkits. This paper presents a novel technique to detect rootkits that modify both control and noncontrol data. The main idea is to externally observe the execution of the kernel during an inference phase and hypothesize invariants on kernel data structures. A rootkit detection phase uses these invariants as specifications of data structure integrity. During this phase, violation of invariants indicates an infection. We have implemented Gibraltar, a prototype tool that infers kernel data structure invariants and uses them to detect rootkits. Experiments show that Gibraltar can effectively detect previously known rootkits, including those that modify noncontrol data structures. © 2011 IEEE.","Baliga A.; Ganapathy V.; Iftode L.","72"
